{
    "game": "Napoleon Total War",
    "version": "1.6 (Steam)",
    "platform": [
        "windows",
        "linux"
    ],
    "created": "2026-03-09",
    "description": "Cheat table for Napoleon Total War Steam version 1.6",
    "notes": "Pointer offsets may vary between game patches. Use AOB scanning for more stable addresses. All AOB patterns are x86 (32-bit) WARSCAPE engine signatures.",
    "verified": false,
    "pointer_chains": {
        "treasury": {
            "module": "napoleon.exe",
            "base_offset": "0x00A1B2C0",
            "offsets": [
                "0x4C",
                "0x10",
                "0x8"
            ],
            "type": "int32",
            "description": "Player faction treasury (gold)",
            "cheat": "infinite_gold",
            "notes": "CampaignManager -> FactionData -> Treasury. Use calibrate_chain() to verify offset for your session."
        },
        "movement_points": {
            "module": "napoleon.exe",
            "base_offset": "0x00A1B2C0",
            "offsets": [
                "0x4C",
                "0x10",
                "0x14"
            ],
            "type": "float",
            "description": "Selected army movement points (campaign map)",
            "cheat": "unlimited_movement",
            "notes": "Same CampaignManager base as treasury; different final offset."
        },
        "construction_timer": {
            "module": "napoleon.exe",
            "base_offset": "0x00A3D4E0",
            "offsets": [
                "0x28",
                "0x8",
                "0xC"
            ],
            "type": "int32",
            "description": "Building construction turns remaining (selected settlement)",
            "cheat": "instant_construction",
            "notes": "CampaignManager -> SettlementManager -> ActiveConstruction"
        },
        "research_timer": {
            "module": "napoleon.exe",
            "base_offset": "0x00A3D4E0",
            "offsets": [
                "0x28",
                "0x10",
                "0xC"
            ],
            "type": "int32",
            "description": "Technology research turns remaining",
            "cheat": "fast_research",
            "notes": "CampaignManager -> TechManager -> ActiveResearch"
        },
        "unit_health": {
            "module": "napoleon.exe",
            "base_offset": "0x00A2D5E0",
            "offsets": [
                "0x14",
                "0x8",
                "0x24"
            ],
            "type": "float",
            "description": "Selected unit health value (battle)",
            "cheat": "god_mode",
            "notes": "BattleManager -> SelectedUnit -> UnitData. Valid only during an active battle."
        },
        "unit_ammo": {
            "module": "napoleon.exe",
            "base_offset": "0x00A2D5E0",
            "offsets": [
                "0x14",
                "0x8",
                "0x30"
            ],
            "type": "int32",
            "description": "Selected unit ammo count (battle)",
            "cheat": "unlimited_ammo",
            "notes": "BattleManager -> SelectedUnit -> UnitData. Valid only during an active battle."
        },
        "unit_morale": {
            "module": "napoleon.exe",
            "base_offset": "0x00A2D5E0",
            "offsets": [
                "0x14",
                "0x8",
                "0x48"
            ],
            "type": "float",
            "description": "Selected unit morale value (battle)",
            "cheat": "high_morale",
            "notes": "BattleManager -> SelectedUnit -> UnitData. Valid only during an active battle."
        },
        "unit_stamina": {
            "module": "napoleon.exe",
            "base_offset": "0x00A2D5E0",
            "offsets": [
                "0x14",
                "0x8",
                "0x3C"
            ],
            "type": "float",
            "description": "Selected unit stamina (battle)",
            "cheat": "infinite_stamina",
            "notes": "BattleManager -> SelectedUnit -> UnitData. Valid only during an active battle."
        },
        "agent_action_points": {
            "module": "napoleon.exe",
            "base_offset": "0x00A1B2C0",
            "offsets": [
                "0x58",
                "0x1C",
                "0x18"
            ],
            "type": "float",
            "description": "Selected agent action points on campaign map",
            "cheat": "infinite_action_points",
            "notes": "CampaignManager -> SelectedAgent -> Action pool."
        },
        "research_points": {
            "module": "napoleon.exe",
            "base_offset": "0x00A3D4E0",
            "offsets": [
                "0x28",
                "0x10",
                "0x18"
            ],
            "type": "int32",
            "description": "Technology research points pool",
            "cheat": "max_research_points",
            "notes": "TechManager -> ResearchPool -> Current points."
        },
        "agent_training_timer": {
            "module": "napoleon.exe",
            "base_offset": "0x00A1B2C0",
            "offsets": [
                "0x58",
                "0x24",
                "0xC"
            ],
            "type": "int32",
            "description": "Turns remaining for the selected agent training queue",
            "cheat": "instant_agent_training",
            "notes": "AgentManager -> TrainingQueue -> Turns remaining."
        },
        "diplomatic_action_cost": {
            "module": "napoleon.exe",
            "base_offset": "0x00A1B2C0",
            "offsets": [
                "0x60",
                "0x18",
                "0x10"
            ],
            "type": "int32",
            "description": "Cost for current diplomatic action",
            "cheat": "free_diplomatic_actions",
            "notes": "DiplomacyManager -> PendingDeal -> Action cost."
        },
        "army_visibility_flag": {
            "module": "napoleon.exe",
            "base_offset": "0x00A1B2C0",
            "offsets": [
                "0x4C",
                "0x28",
                "0x4"
            ],
            "type": "int32",
            "description": "Selected army visibility / fog immunity flag",
            "cheat": "invisible_armies",
            "notes": "CampaignArmy -> Visibility state; 1 keeps the army hidden from fog checks."
        },
        "artillery_reload_timer": {
            "module": "napoleon.exe",
            "base_offset": "0x00A2D5E0",
            "offsets": [
                "0x14",
                "0x8",
                "0x54"
            ],
            "type": "float",
            "description": "Selected artillery reload timer in battle",
            "cheat": "instant_reload",
            "notes": "BattleManager -> SelectedUnit -> WeaponComponent reload timer."
        },
        "unit_range": {
            "module": "napoleon.exe",
            "base_offset": "0x00A2D5E0",
            "offsets": [
                "0x14",
                "0x8",
                "0x68"
            ],
            "type": "float",
            "description": "Selected unit firing range in battle",
            "cheat": "range_boost",
            "notes": "BattleManager -> SelectedUnit -> Weapon stats range."
        },
        "charge_speed": {
            "module": "napoleon.exe",
            "base_offset": "0x00A2D5E0",
            "offsets": [
                "0x14",
                "0x8",
                "0x6C"
            ],
            "type": "float",
            "description": "Selected cavalry charge / movement speed modifier",
            "cheat": "speed_boost",
            "notes": "BattleManager -> SelectedUnit -> Speed stat."
        },
        "unit_regeneration": {
            "module": "napoleon.exe",
            "base_offset": "0x00A2D5E0",
            "offsets": [
                "0x14",
                "0x8",
                "0x70"
            ],
            "type": "float",
            "description": "Selected unit regeneration / heal tick amount",
            "cheat": "infinite_unit_health",
            "notes": "BattleManager -> SelectedUnit -> Regeneration tick value."
        },
        "autoresolve_victory_flag": {
            "module": "napoleon.exe",
            "base_offset": "0x00A1F480",
            "offsets": [
                "0x20",
                "0x10",
                "0x4"
            ],
            "type": "int32",
            "description": "Battle auto-resolve winner flag",
            "cheat": "instant_victory",
            "notes": "AutoResolveManager -> ResultData -> Winner flag (1 = player victory)."
        },
        "public_order": {
            "module": "napoleon.exe",
            "base_offset": "0x00A3D4E0",
            "offsets": [
                "0x30",
                "0x14",
                "0x8"
            ],
            "type": "int32",
            "description": "Selected city public order value",
            "cheat": "max_public_order",
            "notes": "SettlementManager -> PublicOrder component."
        },
        "attrition_rate": {
            "module": "napoleon.exe",
            "base_offset": "0x00A1B2C0",
            "offsets": [
                "0x4C",
                "0x18",
                "0x20"
            ],
            "type": "float",
            "description": "Selected army attrition rate on campaign map",
            "cheat": "zero_attrition",
            "notes": "CampaignArmy -> Attrition component. Freeze at 0.0 to prevent losses."
        },
        "veterancy_upgrade_cost": {
            "module": "napoleon.exe",
            "base_offset": "0x00A3D4E0",
            "offsets": [
                "0x34",
                "0xC",
                "0x10"
            ],
            "type": "int32",
            "description": "Cost for unit veterancy / upgrade action",
            "cheat": "free_upgrades",
            "notes": "UpgradeManager -> Selected upgrade cost."
        }
    },